{
  "schemaVersion": "database.lca-result-family-physical-qualification.v1",
  "issue": "tiangong-lca/database-engine#390",
  "artifactBinding": {
    "schemaPath": "supabase/tests/contracts/lca_result_family_physical_qualification.v1.schema.json",
    "schemaSha256": "50f7c7e98ffcf2b94d70bd36fc69cbf4a3e773e31b92ea45746d8d1aa1cde2a1"
  },
  "source": {
    "repository": "tiangong-lca/database-engine",
    "commitSha": "a29f26a9eb0a6c629ae34e187c6fce4a0c215b1d",
    "predecessorMigrationHead": "20260803090000",
    "predecessorMigrationCount": 181,
    "predecessorMigrationSetSha256": "660edebc4e24e230e3223ba76466660805d0c66d102c9fa3e1a2d76850a6c964"
  },
  "authorization": {
    "preDdlContract": "supabase/tests/contracts/lca_result_family_pre_ddl.v1.json",
    "ddlAuthorized": false,
    "relationMovingDdlAllowed": false,
    "historicalAuthenticatedSelectRemovalAllowed": false,
    "qualificationExecutionAllowed": false,
    "status": "blocked-pending-static-runtime-owner-and-gc-closure"
  },
  "scope": {
    "relations": [
      "public.lca_results",
      "public.lca_result_cache",
      "public.lca_latest_all_unit_results",
      "public.lca_factorization_registry"
    ],
    "routines": [
      "public.lca_read_job_projection(uuid,uuid,uuid,boolean)",
      "public.lca_read_result_projection(uuid,uuid,text,boolean)",
      "public.lca_read_latest_single_solve_result(uuid,uuid,integer)"
    ],
    "excludedFamilies": [
      "lca_package_*",
      "lca_snapshot_gc_runs/items",
      "lcia_result_packages/publications",
      "lca_enqueue_job/lca_legacy_job_type"
    ]
  },
  "candidate": {
    "migrationPath": null,
    "migrationSha256": null,
    "rollbackPath": null,
    "rollbackSha256": null,
    "populatedFixturePath": null,
    "populatedFixtureSha256": null,
    "targetMigrationHead": null
  },
  "evidence": {
    "baselineReceipt": null,
    "freshUpgradeReceipt": null,
    "populatedUpgradeReceipt": null,
    "rollbackRollForwardReceipt": null,
    "lockWalTimeReceipt": null,
    "status": "skeleton-only-no-qualification-claim"
  },
  "dependencyClosure": {
    "requiredSurfaces": [
      "pg_depend",
      "foreign-key-inbound-and-outbound",
      "view-and-pg_rewrite",
      "routine-definition-and-prosrc",
      "relation-composite-type-and-rowtype",
      "dynamic-sql-lexical-candidates",
      "regclass-and-regprocedure-candidates",
      "policy-and-publication-membership"
    ],
    "completenessRequired": true,
    "status": "pending-baseline-capture-and-independent-review"
  },
  "invariants": {
    "relations": [
      "oid",
      "owner",
      "acl-and-column-acl",
      "rls-force-rls-and-policy",
      "foreign-keys-and-delete-semantics",
      "indexes",
      "triggers",
      "publication-membership-and-row-filter",
      "row-count",
      "primary-key-hash",
      "content-hash"
    ],
    "routines": [
      "oid",
      "owner",
      "acl",
      "signature-and-result-type",
      "security-volatility-strictness-parallelism",
      "search-path",
      "definition-hash",
      "exact-cardinality-and-kind"
    ]
  },
  "qualification": {
    "runner": "scripts/issue_390_physical_qualification.py",
    "localOnly": true,
    "destructiveDatabaseRequired": true,
    "phases": [
      "fresh-upgrade",
      "populated-upgrade",
      "failure-atomicity",
      "lock-timeout",
      "wal-and-time-budget",
      "retry",
      "rollback",
      "roll-forward"
    ],
    "minimumRowsPerRelation": 10000,
    "baselineCapture": {
      "maxRowsPerRelation": 100000,
      "statementTimeoutSeconds": 120,
      "digestAlgorithm": "sha256",
      "digestEncoding": "ordered-jsonb-text-lines-v1"
    },
    "budgets": {
      "lockFailureMinimumSeconds": 4.5,
      "lockFailureMaximumSeconds": 8.0,
      "freshUpgradeSeconds": 15.0,
      "populatedUpgradeSeconds": 30.0,
      "migrationWalBytes": 33554432,
      "retrySeconds": 10.0,
      "retryWalBytes": 4194304
    }
  },
  "nonAuthorizingStatement": "This artifact and its read-only baseline receipt do not authorize SET SCHEMA, physical migration, historical authenticated SELECT removal, Hosted mutation, or production mutation."
}
